{
  "schema_version": "1.0",
  "campaign_id": "TODO",
  "generated_at": "2026-08-07T00:00:00Z",
  "evidence": [
    {
      "id": "EV-001",
      "type": "oracle-output",
      "artifact": "artifacts/TODO.log",
      "sha256": "0000000000000000000000000000000000000000000000000000000000000000",
      "captured_at": "2026-08-07T00:00:00Z",
      "collector": "TODO",
      "source": "TODO",
      "parents": [],
      "sensitivity": "INTERNAL",
      "description": "TODO"
    }
  ]
}
